<?xml version="1.0" encoding="UTF-8" ?>
<!DOCTYPE værktøjskasse SYSTEM "værktøjskasseDefinition.dtd">
<værktøjskasse>
    <værktøj>
        <støjniveau enhed="kanonslag">14</støjniveau>
        <art sprog="dk">hammer</art>
        <farver>
            <farve>rød</farve>
            <farve>blå</farve>
            <farve>sort</farve>
        </farver>
    </værktøj>
    <værktøj>
        <støjniveau enhed="decibel">5</støjniveau>
        <art sprog="en">sav</art>
        <farver>
            <farve>rød</farve>
            <farve>blå</farve>
            <farve>sort</farve>
        </farver>
    </værktøj>
    <værktøj>
        <støjniveau>0</støjniveau>
        <art sprog="sw">skruetrækker</art>
        <farver>
            <farve>rød</farve>
            <farve>blå</farve>
            <farve>sort</farve>
        </farver>
    </værktøj>
</værktøjskasse>